{
  "$schema": "https://json-schema.org/draft/2020-12/schema",
  "$id": "https://lacca.local/schemas/oem-scope-v1.schema.json",
  "title": "OemScopeV1",
  "type": "object",
  "required": ["scopeId", "oem", "modelYears", "models", "exteriorPaintFile"],
  "properties": {
    "$schema": { "type": "string" },
    "scopeId": { "type": "string" },
    "oem": { "type": "string" },
    "region": { "type": "string" },
    "modelYears": {
      "type": "object",
      "required": ["from", "to"],
      "properties": {
        "from": { "type": "integer" },
        "to": { "type": "integer" }
      },
      "additionalProperties": false
    },
    "models": {
      "type": "array",
      "items": { "type": "string" },
      "minItems": 1
    },
    "notes": { "type": "string" },
    "exteriorPaintFile": { "type": "string" }
  },
  "additionalProperties": false
}
