{
  "$schema": "../../../schemas/oem-scope-v1.schema.json",
  "scopeId": "alfa-romeo-vpic-v1",
  "oem": "Alfa Romeo",
  "modelYears": {
    "from": 2000,
    "to": 2026
  },
  "models": [
    "164",
    "4C",
    "8C Competizione Spider",
    "Giulia (952)",
    "GTV6",
    "Milano",
    "Spider",
    "Stelvio",
    "Tonale"
  ],
  "notes": "Alfa Romeo model catalog sourced from NHTSA vPIC (GetModelsForMake). 9 distinct models. Paint catalog intentionally empty for this scope; the web UI falls back to generic colors when an OEM has no dedicated paint rows yet. Merge with curated scopes via merge-oem-scopes to enrich with real paint codes.",
  "exteriorPaintFile": "./exterior-paints-v1.json"
}
