{
  "$schema": "../../../schemas/oem-scope-v1.schema.json",
  "scopeId": "alfa-romeo-paintref-v1",
  "oem": "Alfa Romeo",
  "modelYears": {
    "from": 2000,
    "to": 2026
  },
  "models": [
    "Spider"
  ],
  "notes": "Alfa Romeo exterior paint codes sourced from PaintRef (paintref.com) by fetch-paintref-all, plus a 2016 chip-display list ingested from the Internet Archive (Wayback) capture of chipdisplay.cgi?manuf=Alfa-Romeo&year=2017 (PaintRef rendered that URL as the 2016 Alfa-Romeo exterior chip page; rows use provenanceId paintref-wayback:…). Entries with LAB use confidence=\"spec\"; hex-only entries and chip-image samples use confidence=\"derived\". Chip-sampled rows carry source=\"paintref_chip\" with provenance back to the averaged PNG at data/sources/paintref/chipimages/. Verify spec-grade entries with spectro before production claims. 1 distinct models observed in advanced-search rows (sanitized). Merge with curated scopes via merge-oem-scopes to pick best-confidence LAB per code.",
  "exteriorPaintFile": "./exterior-paints-v1.json"
}
