{
  "$schema": "../../../schemas/oem-scope-v1.schema.json",
  "scopeId": "isuzu-vpic-v1",
  "oem": "Isuzu",
  "modelYears": {
    "from": 2000,
    "to": 2026
  },
  "models": [
    "4000 Series Medium Duty",
    "5000 Series Medium Duty",
    "6000 Series Medium Duty",
    "7000 Series Medium Duty",
    "Amigo",
    "Ascender",
    "Axiom",
    "F6",
    "F7",
    "Forward Control",
    "Forward Control (for walk-in van)",
    "FRR",
    "FSR",
    "FTR",
    "FTR/FVR",
    "FTR/FVR/EVR",
    "FVR",
    "H-Series",
    "Hombre",
    "i-280",
    "i-290",
    "i-350",
    "i-370",
    "I-Mark",
    "IMPULSE",
    "Medium Front Engine Bus",
    "Medium Rear Engine Bus",
    "NPR",
    "NPR-HD",
    "NPR-XD",
    "NPR/NPR-HD",
    "NQR",
    "NQR/NRR",
    "NRR",
    "Oasis",
    "Pickup",
    "REACH",
    "Rodeo",
    "Rodeo/Amigo",
    "Stylus",
    "T6F",
    "T7F",
    "T8F",
    "Trooper",
    "Trooper II",
    "VehiCross"
  ],
  "notes": "Isuzu model catalog sourced from NHTSA vPIC (GetModelsForMake). 46 distinct models. Paint catalog intentionally empty for this scope; the web UI falls back to generic colors when an OEM has no dedicated paint rows yet. Merge with curated scopes via merge-oem-scopes to enrich with real paint codes.",
  "exteriorPaintFile": "./exterior-paints-v1.json"
}
