{
  "$schema": "../../../schemas/oem-scope-v1.schema.json",
  "scopeId": "fiat-vpic-v1",
  "oem": "Fiat",
  "modelYears": {
    "from": 2000,
    "to": 2026
  },
  "models": [
    "124 Spider",
    "500",
    "500e",
    "500L",
    "500X",
    "Brava",
    "Ducato",
    "Freemont",
    "Spider 2000",
    "Strada",
    "X 1/9"
  ],
  "notes": "Fiat model catalog sourced from NHTSA vPIC (GetModelsForMake). 11 distinct models. Paint catalog intentionally empty for this scope; the web UI falls back to generic colors when an OEM has no dedicated paint rows yet. Merge with curated scopes via merge-oem-scopes to enrich with real paint codes.",
  "exteriorPaintFile": "./exterior-paints-v1.json"
}
