{
  "$schema": "../../../schemas/oem-scope-v1.schema.json",
  "scopeId": "kia-autocolorlibrary-v1",
  "oem": "Kia",
  "modelYears": {
    "from": 2015,
    "to": 2019
  },
  "models": [],
  "notes": "Kia exterior paint rows sampled from Auto Color Library chip sheets (autocolorlibrary.com) via acl-labeler. LAB is hex-derived from averaged swatch regions; confidence=\"derived\", source=\"autocolorlibrary_swatch\". Merge with PaintRef or curated scopes via merge-oem-scopes. Verify with spectro before production claims.",
  "exteriorPaintFile": "./exterior-paints-v1.json"
}
