{
  "$schema": "../../../schemas/oem-scope-v1.schema.json",
  "scopeId": "volkswagen-vpic-v1",
  "oem": "Volkswagen",
  "modelYears": {
    "from": 2000,
    "to": 2026
  },
  "models": [
    "Arteon",
    "Atlas",
    "Atlas Cross Sport",
    "Beetle",
    "Cabrio",
    "CABRIOLET",
    "CC",
    "Corrado",
    "Dasher",
    "e-Golf",
    "Eos",
    "EuroVan",
    "FOX",
    "GLI",
    "Golf",
    "Golf Alltrack",
    "Golf GTI",
    "Golf III",
    "Golf R",
    "Golf SportWagen",
    "GTI",
    "ID. Buzz",
    "ID.4",
    "Jetta",
    "Jetta GLI",
    "Jetta SportWagen",
    "Jetta Wagon",
    "KOMBI",
    "Passat",
    "Phaeton",
    "Quantum",
    "R32",
    "Rabbit",
    "Routan",
    "Scirocco",
    "Taos",
    "Tiguan",
    "Tiguan Limited",
    "Touareg",
    "Vanagon"
  ],
  "notes": "Volkswagen model catalog sourced from NHTSA vPIC (GetModelsForMake). 40 distinct models. Paint catalog intentionally empty for this scope; the web UI falls back to generic colors when an OEM has no dedicated paint rows yet. Merge with curated scopes via merge-oem-scopes to enrich with real paint codes.",
  "exteriorPaintFile": "./exterior-paints-v1.json"
}
