{
  "$schema": "../../../schemas/oem-scope-v1.schema.json",
  "scopeId": "volvo-vpic-v1",
  "oem": "Volvo",
  "modelYears": {
    "from": 2000,
    "to": 2026
  },
  "models": [
    "240 Series",
    "260 Series",
    "740 Series",
    "760 Series",
    "780 Series",
    "850 Series",
    "940 Series",
    "960 Series",
    "9700",
    "ACL",
    "B10M",
    "B12B",
    "B12M",
    "B12R",
    "B13R",
    "B5R",
    "B5TL",
    "B7R",
    "B8L",
    "B8R",
    "B9L",
    "B9R",
    "B9S",
    "B9TL",
    "BE",
    "BFE",
    "BRH",
    "BRLH",
    "BXR",
    "BXRB",
    "BXXR",
    "C30",
    "C40",
    "C70",
    "C70 / C30",
    "Cab Behind Engine",
    "Cab Over Engine HT",
    "Cab Over Engine LT",
    "CACL",
    "CNE",
    "CNR",
    "CWG",
    "EC40",
    "EX30",
    "EX30 CC",
    "EX40",
    "EX90",
    "F12 w/F7 Cab",
    "F6 w/F7 Cab",
    "FE",
    "FM10",
    "FML",
    "NE",
    "NE42",
    "NE64",
    "NR",
    "NR64",
    "S40",
    "S60",
    "S60 Cross Country",
    "S70",
    "S80",
    "S90",
    "V40",
    "V50",
    "V60",
    "V60CC",
    "V70",
    "V90",
    "V90CC",
    "VAH",
    "VHD",
    "VN",
    "VNC",
    "VNL",
    "VNL (4)",
    "VNM",
    "VNR",
    "VNR (4)",
    "VNX",
    "Volvo Trailers",
    "VS",
    "VT",
    "WAH",
    "WCA",
    "WG",
    "WHEB",
    "WHL",
    "WHLB",
    "WHR",
    "WIA",
    "WX",
    "WXLL",
    "WXLM",
    "WXR",
    "XC40",
    "XC60",
    "XC70",
    "XC90"
  ],
  "notes": "Volvo model catalog sourced from NHTSA vPIC (GetModelsForMake). 99 distinct models. Paint catalog intentionally empty for this scope; the web UI falls back to generic colors when an OEM has no dedicated paint rows yet. Merge with curated scopes via merge-oem-scopes to enrich with real paint codes.",
  "exteriorPaintFile": "./exterior-paints-v1.json"
}
