{
  "$schema": "../../../schemas/oem-scope-v1.schema.json",
  "scopeId": "ferrari-vpic-v1",
  "oem": "Ferrari",
  "modelYears": {
    "from": 2000,
    "to": 2026
  },
  "models": [
    "12Cilindri",
    "296",
    "3.2 Mondial",
    "308 Convertible",
    "308GTB",
    "308GTB Quattrovalvole",
    "308GTBi",
    "308GTS",
    "308GTS Quattrovalvole",
    "308GTSi",
    "328",
    "328 GTB",
    "328 GTS",
    "348 Spider",
    "348 tb",
    "348 ts",
    "355 Berlinetta",
    "355 GTS",
    "355 Spider",
    "360",
    "430",
    "456",
    "456M",
    "458",
    "458 Italia",
    "488",
    "512 TR",
    "550 Barchetta",
    "550 Maranello",
    "575M Maranello",
    "599",
    "599 GTB Fiorano",
    "612 Scaglietti",
    "812",
    "California",
    "California T",
    "Challenge Stradale",
    "Daytona SP3",
    "Enzo",
    "F12 Berlinetta",
    "F12 Special Series",
    "F12 tdf (Tour de France)",
    "F355",
    "F40",
    "F430",
    "F50",
    "F60 America",
    "F8",
    "FF",
    "GTC4Lusso",
    "La Ferrari",
    "Mondial 8",
    "Mondial T",
    "Monza SP1/SP2",
    "Portofino",
    "Portofino M",
    "Purosangue",
    "Roma",
    "SF90",
    "Testarossa"
  ],
  "notes": "Ferrari model catalog sourced from NHTSA vPIC (GetModelsForMake). 60 distinct models. Paint catalog intentionally empty for this scope; the web UI falls back to generic colors when an OEM has no dedicated paint rows yet. Merge with curated scopes via merge-oem-scopes to enrich with real paint codes.",
  "exteriorPaintFile": "./exterior-paints-v1.json"
}
